{
  "candidate": {
    "invoice_ids": [
      "e05-synth-invoice-33"
    ],
    "name_crop_cluster_id": "name-dhash-cac91b36c958d1e0",
    "name_suggestions": [
      {
        "accepted": false,
        "confidence": 98.65,
        "crop_reference": {
          "crop_id": "33_row10",
          "file": "tests/fixtures/real/n02-reference-crops/33_row10.png",
          "sha256": "4896821e8a88991d97558068eaa4a5069d900ac27f28b4c47ab868f3c642c899"
        },
        "engine": "ParisaOCR",
        "engine_version": "0.7.2",
        "lines": [
          "پیش دستی کاغذی",
          "ماتایی تم"
        ],
        "model_version": "parisaocr-fa-0.1",
        "suggested_name": "پیش دستی کاغذی\nماتایی تم"
      }
    ],
    "occurrence_count": 1,
    "price_observations": [],
    "quantity_sum": 15,
    "reference_crop_file": "tests/fixtures/real/n02-reference-crops/33_row10.png",
    "source_crop_ids": [
      "33_row10"
    ]
  },
  "name_suggestions_enabled": true,
  "price_observation_date_source": "probe.captured_at",
  "schema_version": "n05.product-candidate.v1",
  "source_fixture_file": "tests/fixtures/real/canonical/canonical-33.json",
  "source_fixture_id": "33",
  "source_schema_version": "n02.product-candidates.v1"
}
